Visits,id,Title,Parent,Parent Slug
0,3917,Taking Advantage of Government Business Loans,8015,business/sba
8,3922,Start Up Business Loans: 8 Different Options,129,business
16,3926,How to Fund A Small Business,7494,business/requirements
0,3930,Planning Your Small Business Funding for 2018,8474,business/small
10,3933,How to Find Small Business Grants,129,business
0,3936,Business Loans for Bad Credit Applicants: Do They Exist?,129,business
17,3939,A Basic Guide to Microloans,8015,business/sba
20,3942,The Pros and Cons of a Business Acquisition Loan,129,business
0,3947,Small Business Loans for Women in 2017,8474,business/small
18,3950,Running a Small Business: Tips from Successful Business Owners,129,business
0,3953,How to Find Small Business Investors,129,business
18,3956,Short Term Business Loans: The Basics,8018,business/short-term
3,3959,An Easy Way to Get New Business Loans,129,business
0,3962,The Pros and Cons of Small Business Administration (SBA) Business Loans,8015,business/sba
7,4087,FAFSA Application Guide: 7 Steps to Get Started,168,student
3,4832,Alternatives to Private Student Loan Forgiveness,172,student/refinance
5,5177,Mortgage Fraud: Don't Be an Accidental Criminal,146,home/mortgage
2,5182,New State Rankings Report Says Down Payment Amounts are Increasing,7449,home/mortgage/down-payment
0,5188,What You Should Know Before Applying For a Mortgage,146,home/mortgage
4,5193,Will Mortgage Underwriting Get Tougher?,146,home/mortgage
23,5295,Lending Discrimination: What it Is and Isn't,146,home/mortgage
0,5328,Financing a Car: A Guide to Getting Your Wheels,99,auto
0,5399,5 Ways to Make Smarter Use of Your Credit Cards,133,credit-cards/tips
0,5499,Help for Single Women Home Buyers,146,home/mortgage
0,5501,Ask an expert: Seller Breaking a Real Estate Contract,146,home/mortgage
0,5502,Buying a Home with a Shared-Equity Mortgage,146,home/mortgage
0,5503,How Lease-to-Own Homes Work: A Guide,146,home/mortgage
0,5514,"Letter of Explanation: What, Why and How",146,home/mortgage
0,5518,Is the New 15/15 ARM Money Saver Loan for You?,146,home/mortgage
9,5522,Credit Catastrophe? Improve Credit Scores in 5 Steps,20369,credit-repair
0,5533,National Average Monthly Mortgage Payment,146,home/mortgage
0,5548,Understanding Lender Fees,146,home/mortgage
0,5549,Understanding Your Escrow Account,146,home/mortgage
0,5553,Denied Credit for Your Home Loan: What's Next?,146,home/mortgage
0,5554,Why It Can Be Difficult to Get Small Mortgage Loans,146,home/mortgage
0,5555,Federal Funds Rate: How the Fed Impacts Interest Rates,146,home/mortgage
0,5556,ARM Caps Can Curtail High Payment Shocks,146,home/mortgage
0,5583,Construction Loans,146,home/mortgage
0,5589,Good Faith Estimate,146,home/mortgage
0,5597,Home Loan Q & A: Getting a Mortgage with a New Job,146,home/mortgage
0,5599,How Surprise Undisclosed Debt Can Sink Your Mortgage Application,146,home/mortgage
0,5713,6 Reasons You Need a Credit Card with an Annual Fee,133,credit-cards/tips
0,5717,Spark® Miles Select for Business Review,133,credit-cards/tips
0,5722,10 Signs You Need a Personal Loan,164,personal
3,5723,Inflation Threat to Mortgage Rates Continues to Grow,146,home/mortgage
4,5726,Inflation Looks Like a Bigger Threat to Mortgage Rates than the Fed,146,home/mortgage
0,5727,What's The Difference Between Freelancer and Small Business Owner Roles?,129,business
0,5728,Brexit and Low Mortgage Rates for the Summer,5299,home/mortgage/rates
0,5734,When is your mortgage payment late?,146,home/mortgage
4,5735,Allowance For Kids: How Much is too Much,176,finance
0,5736,Fed Slashes Interest Rates,133,credit-cards/tips
9,5737,How To Buy A Car in 7 Steps,99,auto
0,5738,7 credit card agreement terms defined,133,credit-cards/tips
0,5739,7 ways to protect yourself from credit card fraud,133,credit-cards/tips
0,5740,7 things to look for in your mortgage loan,146,home/mortgage
0,5741,Convert your garage into living space,146,home/mortgage
14,5743,What to consider before you cosign a mortgage loan with a significant other,146,home/mortgage
0,5746,Types of Credit Scores: Understanding the Differences,2206,credit-score
0,5750,Getting Your Prequalification Letter,2990,home/mortgage/pre-approval
0,5753,How to Improve Your Credit Score,20369,credit-repair
6,5754,How Your Checking Account Impacts Your Credit Score,2206,credit-score
2,5757,Credit Score and Mortgage: Five Surprising Things You Don't Know,2206,credit-score
0,5758,Unsecured Personal Loans: When Do They Make Sense?,3123,personal/unsecured
0,5760,Signature Loans with No Credit Check: Don't Get Ripped Off,3119,personal/signature
0,5761,Secured Credit Cards,133,credit-cards/tips
0,5762,Loans for Bad Credit,20369,credit-repair
0,5763,Can You Change Your Credit Card's Due Date?,133,credit-cards/tips
3,5765,Survey: 44% of $100-149K Earners Live Paycheck to Paycheck,176,finance
0,5767,Survey: 52% of Americans Are Clueless About Credit Card Rewards,133,credit-cards/tips
13,5768,How to Get a Excellent Credit Score,2206,credit-score
5,5769,Types of Credit: Tips for Credit Improvement,2206,credit-score
16,5770,Why The Age of Your Credit History is Important,2206,credit-score
3,5771,Credit Payment History: How it Affects Your Credit Score,2206,credit-score
2,5774,Title Insurance: What You Pay When You Refinance,150,home/refinance
0,5775,FHA Refinance: Conventional or Streamline?,27,home/fha
0,5776,Getting a Mortgage Pre-Approval Letter,2990,home/mortgage/pre-approval
0,5783,What to do when you are denied credit by a lender,20369,credit-repair
0,5787,How to read a mortgage statement,146,home/mortgage
0,5788,Down Payment on a Used Car: How Much To Put Down,99,auto
11,5789,How to Avoid Car Leasing Charges,99,auto
9,5790,Car Value: Learn How to Determine a Cars Value,99,auto
0,5791,Unsecured Loan Basics,3123,personal/unsecured
0,5792,Credit cards with reward benefits,133,credit-cards/tips
0,5793,Avoiding credit card traps,133,credit-cards/tips
0,5794,Credit card minimum payments,133,credit-cards/tips
0,5795,How Fed rate cuts affect credit card interest rates,133,credit-cards/tips
0,5796,The hidden costs of credit cards,133,credit-cards/tips
0,5797,What you need to know about credit cards,133,credit-cards/tips
0,5798,Why store credit cards can ruin your credit score,133,credit-cards/tips
10,5799,What to Know Before Filing Bankruptcy,20369,credit-repair
0,5800,Co-signing a Loan: Understand the Obligation,2206,credit-score
0,5801,Trigger Leads Opt Out: Credit Bureaus Sell Personal Data,2206,credit-score
15,5802,How Bad Credit Affects You,20369,credit-repair
18,5803,How interest rates affect credit,2206,credit-score
14,5804,Bankrupcy Laws You Should be Aware of Before Filing,23650,bankruptcy
0,5805,Hard Credit Inquiry Versus Soft Credit Inquiry,2206,credit-score
7,5806,How to Check Your Credit Report: Things You Should Be Looking For,2206,credit-score
5,5807,Fair Credit Reporting Act: Understanding Your Rights,2206,credit-score
17,5808,VantageScore FAQs,2206,credit-score
10,5809,Prevent identity theft,2206,credit-score
10,5810,How to interview a buyer's agent,146,home/mortgage
5,5811,What Does a Real Estate Lawyer Do?,146,home/mortgage
0,5814,Do Mortgage Rates Vary by Lender?,5299,home/mortgage/rates
0,5815,Negotiating the Lowest Mortgage Interest Rates,5299,home/mortgage/rates
0,5816,What Determines Your Mortgage Rate?,5299,home/mortgage/rates
10,5817,Jumbo Rates Are Falling Down,146,home/mortgage
0,5818,HARP 2.0 Refinance Program,624,home/refinance/harp
0,5820,Different Hoax for Different Folks: Mortgage Advertising Scams,2206,credit-score
6,5821,Factors that Affect Mortgage Rates: The Economy,5299,home/mortgage/rates
0,5824,The 10-Year Fixed Rate Mortgage,5299,home/mortgage/rates
0,5825,The 30-Year Fixed Rate Mortgage Loan,5299,home/mortgage/rates
0,5826,The 5/1 Hybrid ARM,5299,home/mortgage/rates
0,5828,What the Past Can (and Can't) Tell Us about Future Mortgage Interest Rates,5299,home/mortgage/rates
0,5830,Is the APR Always Higher than the Interest Rate?,5299,home/mortgage/rates
0,5831,A 15 Year Mortgage Is a Benefits Bonanza,5299,home/mortgage/rates
0,5833,Advantages of a 15 Year Mortgage,5299,home/mortgage/rates
11,5834,10-Year Fixed Refinance Mortgage Loan,5299,home/mortgage/rates
0,5985,The 15-Year Fixed-Rate Refinance,5299,home/mortgage/rates
0,5986,Is a 5/5 ARM the Mortgage Loan for You?,5299,home/mortgage/rates
0,5987,CAIVRS: The Government's Secret DO-NOT-LEND List,146,home/mortgage
0,5988,How Do Credit Card Introductory APRs Work?,133,credit-cards/tips
0,5990,Does Credit Repair or Debt Management Hurt Credit Ratings?,20369,credit-repair
0,5992,How To Dispute Credit Report Errors,20369,credit-repair
0,5993,Do inquiries on my credit report hurt my credit score?,133,credit-cards/tips
6,5995,How Long Does Negative Information Stay on my Credit Reports?,20369,credit-repair
0,5996,How to Choose the Best Credit Card for Your Needs,133,credit-cards/tips
3,5998,Why Jumbo Mortgage Rates Are Sagging,146,home/mortgage
7,5999,Forecast: How Long Can Mortgage Rates Defy the Odds?,5299,home/mortgage/rates
0,6007,"APR vs Interest Rate: What's the ""Real"" Mortgage Rate?",5299,home/mortgage/rates
0,6008,Mortgage APR: How to Compare Home Loans,5299,home/mortgage/rates
0,6009,"Peer to peer Loans: Lenders May not Be Your ""Peers""",3115,personal/peer-to-peer
0,6010,Bad Credit Score: 3 Things That Can Mess Up a Good Credit Score,2206,credit-score
11,6011,Is an ARM Mortgage Right for You?,146,home/mortgage
0,6012,3 Tips for Using Credit Cards to Boost Your Credit Score,133,credit-cards/tips
0,6013,The 5 Top Credit Cards At LendingTree,133,credit-cards/tips
10,6015,Q&A: 3 Most Common Credit Questions,2206,credit-score
0,6016,Unsecured Loans after Bankruptcy: What You Need to Know,3123,personal/unsecured
4,6020,HARP Extension 2017: Act Soon,624,home/refinance/harp
0,6021,Top 5 Credit Cards For Excellent Credit,133,credit-cards/tips
0,6023,5 of the Best Perks to Look for When Shopping for Credit Cards,133,credit-cards/tips
0,6026,You're Spending Too Much On Travel If You Don't Have The Right Card,133,credit-cards/tips
0,6027,Business Credit Report: All You Need to Know to Improve it,2206,credit-score
0,6029,Why You Should Understand APR and Use An APR Calculator,133,credit-cards/tips
0,6030,Q&A: Can I get an unsecured credit card if I have bad credit?,133,credit-cards/tips
4,6031,What Does a Mortgage Rate Spike Mean for Buyers and Sellers?,5299,home/mortgage/rates
0,6032,The Best Credit Cards for Young Families,133,credit-cards/tips
0,6033,How to Cancel a Credit Card Without Ruining Your Credit Score,133,credit-cards/tips
0,6034,5 Surprising Things That Do Not Affect Your Credit Score,2206,credit-score
0,6035,Q&A: How Many Rewards Credit Cards Should I Have?,133,credit-cards/tips
0,6037,Q&A: How is the minimum payment on credit cards calculated?,133,credit-cards/tips
0,6039,Can You Have Two of the Exact Same Rewards Credit Cards?,133,credit-cards/tips
0,6040,Understanding Your Business Credit Report,129,business
0,6041,What Does My Credit Score Mean in 2017,2206,credit-score
0,6043,How to Apply for a Small Business Loan: Your 9-Step Guide,7494,business/requirements
11,6044,How to Remove Collections from your Credit Report,20369,credit-repair
0,6045,What Does Charge Off Mean On Your Credit Report?,2206,credit-score
0,6046,Should You Lock or Float Your Mortgage Rate?,5299,home/mortgage/rates
0,6048,Q&A: Can I Transfer More Than One Card Balance to a Balance Transfer Credit Card?,133,credit-cards/tips
0,6049,8 Ways to Prevent Credit Card Theft,133,credit-cards/tips
0,6050,Q&A: What Should I Do About My Deceased Parent's Credit Cards?,133,credit-cards/tips
0,6051,5 Surefire Ways to Increase Your Credit Card Limit,133,credit-cards/tips
0,6052,This One Trick Can Save You Thousands in Credit Card Debt,133,credit-cards/tips
0,6053,Here's How To Build Equity in Your Home,142,home/home-equity
3,6055,The History of Mortgage Rates: Then and Now,5299,home/mortgage/rates
0,6056,Q&A: What Is a Cash Advance?,133,credit-cards/tips
0,6057,Mortgage Rates: What to Expect in 2016,5299,home/mortgage/rates
0,6058,Best Credit Cards for Holiday Shopping 2015,133,credit-cards/tips
0,6059,Q&A: What Is a Black Card?,133,credit-cards/tips
0,6060,Q&A: What is CSC?,133,credit-cards/tips
3,6061,What if Mortgage Rates Went Back to the Future?,5299,home/mortgage/rates
0,6062,Q&A: What Are Grey Charges on a Credit Card Statement?,133,credit-cards/tips
0,6063,How Chip Cards Work,133,credit-cards/tips
10,6064,What Happens If You Default On Student Loans?,172,student/refinance
0,6066,My Credit Card Application Was Declined - Can I Still Get the Card?,133,credit-cards/tips
15,6067,What is a Promissory Note?,2206,credit-score
0,6068,Q&A: Can You Buy a Money Order With a Credit Card?,133,credit-cards/tips
0,6069,What Do You Need to Rent a Car?,133,credit-cards/tips
0,6070,Q&A: Should I Close Credit Card Accounts if I Don't Use the Cards Anymore?,133,credit-cards/tips
0,6071,Can You Get Cash Back With a Credit Card?,133,credit-cards/tips
0,6072,5 Balance Transfer Credit Cards,133,credit-cards/tips
0,6073,Does a Free Credit Report Hurt Your Credit?,2206,credit-score
0,6074,What is a Chargeback?,133,credit-cards/tips
3,6075,Should You Put Christmas on Credit This Year?,133,credit-cards/tips
0,6076,Q&A: Will My Credit Card Company Close My Account If I Don't Use My Card?,133,credit-cards/tips
0,6077,3 Best Student Credit Cards,133,credit-cards/tips
0,6078,5 Best No Fee Credit Cards,133,credit-cards/tips
3,6079,How Will the Interest Rate Hike Affect Mortgages?,5299,home/mortgage/rates
0,6081,How is Credit Card Interest Calculated?,133,credit-cards/tips
0,6082,4 Things You Need to Know About the 2016 Mortgage Market,5299,home/mortgage/rates
0,6084,How to Get Medical Loans with Bad Credit,3113,personal/medical
0,6085,5 Reasons Higher Credit Card Rewards Don't Make Sense,133,credit-cards/tips
0,6089,How to Negotiate Medical Bills,3113,personal/medical
0,6094,5 Ways to Get Out of Paying Your Credit Card's Annual Fee,133,credit-cards/tips
0,6096,Business Loan vs. Personal Loan: Which Is Better for Your Small Business?,129,business
0,6098,Getting an FHA Streamline Refinance on Investment Property,27,home/fha
2,6100,Brexit: What Is It and Why Does It Matter?,5299,home/mortgage/rates
0,6106,American Airlines AAdvantage® Program 2016,133,credit-cards/tips
2,6108,Why Now Is the Time to Refinance Your Mortgage,150,home/refinance
0,6109,4 Alternatives to a Traditional Personal Loan,164,personal
0,6110,Can You Get a Mortgage with Credit Card Debt?,146,home/mortgage
0,6111,Give Me Credit Cards: Are You Ready for a Cashless Society?,133,credit-cards/tips
5,6112,4 Important Things to Consider When Getting a Small Business Loan,8474,business/small
0,6113,American's Credit Card Debt Approaches Post Recession Levels,133,credit-cards/tips
0,6114,Are College Students Becoming More Responsible with Credit Cards?,133,credit-cards/tips
0,6115,Best Cash Back Tools,133,credit-cards/tips
0,6116,6 Facts About No Interest Credit Cards,133,credit-cards/tips
0,6117,"With Credit Cards, More Thieves Embracing 'New-Account Fraud'",133,credit-cards/tips
0,6118,4 Credit Cards Perfect for a Home Remodeling Project,133,credit-cards/tips
0,6119,"EMV Credit Card Adoption Proceeds, But Merchants Holding Back Progress",133,credit-cards/tips
0,6120,What Do You Need to Qualify for a Business Credit Card?,133,credit-cards/tips
0,6121,Applying for Credit Cards? Your Odds Might Be Better as Average FICO Score Rises,133,credit-cards/tips
0,6371,Personal Loans for People With Bad Credit,164,personal
0,7061,Tips for First Time Home Buyers,146,home/mortgage
0,7064,Mortgage Application: How to Apply For a Mortgage,146,home/mortgage
0,7067,How Much House Can I Afford?,146,home/mortgage
0,7070,The Complete Guide to Hard Money Loans,146,home/mortgage
0,7073,What Credit Score Do You Need to Buy a House?,146,home/mortgage
0,7077,Home Loans For Bad Credit,146,home/mortgage
0,7080,The Best Time for Selling Your House,146,home/mortgage
14,7092,How to Save for a House,7449,home/mortgage/down-payment
0,7099,Understanding Mortgage Closing Costs,7457,home/mortgage/closing-costs
0,7381,What Is a Reverse Mortgage?,234,home/reverse
5,7529,When Renting is Better than Buying a Home?,176,finance
12,7546,What is a Credit Report?,2206,credit-score
0,7551,What's the Difference Between a Charge Card and a Credit Card,133,credit-cards/tips
0,7557,How to Get Approved for a Credit Card After Bankruptcy,133,credit-cards/tips
5,7561,Guide to Student Grants – How and Where to Find Them,168,student
0,7603,Understanding 5 Year Fixed Mortgage Rates,5299,home/mortgage/rates
0,7609,Small Business License Checklist,7494,business/requirements
0,7613,All About Minority Business Loans,129,business
0,7617,6 Steps to Setting Up a Small Business,7494,business/requirements
2,7625,What You Need to Know About Student Debt,172,student/refinance
0,7633,How to Buy a House With No Money Down?,7449,home/mortgage/down-payment
0,7639,How to Get a Personal Loan:  4 Things to Know,164,personal
10,7651,Interest-Only Mortgages: What Are They and Are They a Good Option?,146,home/mortgage
0,7661,Mortgage APR vs Interest Rate: What's the Difference?,5299,home/mortgage/rates
0,7667,How to Buy a House with No Money Down,7449,home/mortgage/down-payment
8,7672,The 5 Minute Mortgage: Mortgage Comparison with LoanExplorer,146,home/mortgage
0,7679,What Is a Home Equity Loan and Should You Get One?,142,home/home-equity
0,7684,Guaranteed Loans: Why Personal Loans Are Often a Better Choice,164,personal
0,7687,What is an ARM Loan?,146,home/mortgage
7,7701,6 Things Debt-Free Families Have in Common,138,debt-consolidation
0,7712,Understanding Debt Forgiveness,138,debt-consolidation
10,7719,What You Need to Know About Cancellation of Debt (COD) Income,138,debt-consolidation
0,7724,The Truth About Debt Reduction Services,138,debt-consolidation
0,7727,Refinancing a Second Mortgage,150,home/refinance
13,7734,Options for Refinancing Your Home in 2018,150,home/refinance
0,7791,4 Tips for Managing Your Small Business Finances,129,business
4,7795,5 Steps for Business Credit Repair,129,business
0,7799,How to Get a Bridge Loan,146,home/mortgage
0,7803,How to Qualify for a Home Equity Loan in 2018,142,home/home-equity
0,7806,What You Need to Know about Commercial Mortgage Refinance,150,home/refinance
0,7809,Short Term Loans: Understanding the Risks,164,personal
0,7817,How Much of an FHA Loan Can I Qualify for and Afford?,27,home/fha
11,7823,9 Things That Can Boost the Cost of Selling a House,146,home/mortgage
0,7827,How to Apply for a Personal Loan,164,personal
0,7834,Tips for First-Time Homebuyers with Bad Credit,146,home/mortgage
0,7846,Selling a House with a Reverse Mortgage,234,home/reverse
6,7853,How to Find Average Mortgage Rates,5299,home/mortgage/rates
0,7859,How To Get Secured Business Loans,129,business
0,7899,Can You Refinance a Reverse Mortgage and Is It a Smart Move?,234,home/reverse
0,7904,How Much Equity Do You Need for a Reverse Mortgage?,234,home/reverse
0,7911,Are Bank Loans the Best Option for Personal Loans?,164,personal
0,7914,Understanding USDA Home Loans,14502,home/usda
6,7917,HARP Housing: Loan Requirements and Alternatives,624,home/refinance/harp
0,7925,12 Key Reverse Mortgage Questions – Answered,234,home/reverse
0,7928,Types of Home Buying Programs,7455,home/mortgage/types
0,7933,Understanding Mortgage Refinance Closing Costs,150,home/refinance
0,7937,How to Get a Business Auto Loan,99,auto
0,7945,How to Find the Best Refinance Companies for Mortgages in 2018,150,home/refinance
0,7948,4 Easy Business Loans to Consider,129,business
7,7959,How to Sell Your House,146,home/mortgage
0,7968,Understanding Government Refinance Programs,150,home/refinance
0,7971,5 Steps to an Easy Loan,7592,personal/emergency
0,7990,How to Lower your Monthly Car Payments,99,auto
0,7994,How Does a Home Equity Loan Work?,142,home/home-equity
2,8223,Your Guide to the Federal Perkins Loan Program,168,student
0,8286,Mobile & Manufactured Home Loan Guide,146,home/mortgage
0,8456,"FHA Mortgage Insurance: What, Why and How Much",27,home/fha
0,8459,Getting an ARM Mortgage: Pros and Cons,7455,home/mortgage/types
0,8462,How to Get a Personal Loan,164,personal
0,8490,How to Refinance Your Investment Property,150,home/refinance
0,8823,Consumer Loans: Explore Your Lending Options,176,finance
6,8891,Mortgage Rates in 2017: What to Expect,5299,home/mortgage/rates
7,8906,Should You Bundle Your Home and Auto Insurance?,4825,insurance/home
6,8909,10 Factors That Highly Influence Home Insurance Rates,4825,insurance/home
8,8915,How to Compare Home Insurance Quotes,4825,insurance/home
4,8918,Cheap Home Insurance: Bargain or Blunder?,4825,insurance/home
5,8923,How Much Is Home Insurance?,4825,insurance/home
0,8983,What Is a Stafford Loan & How Do You Get One?,168,student
0,9015,Collateral Loans 101: How do These Loans Work?,164,personal
0,9022,How to Apply for a Loan in 4 Easy Steps,164,personal
0,9529,How to Qualify for the Obama Refinance Program,624,home/refinance/harp
0,9673,Long Term Personal Loans,164,personal
0,9821,HARP Program Reviews from the Experts,624,home/refinance/harp
0,9931,What is PITI?,146,home/mortgage
0,9944,How the Mortgage Formula Determines Your Monthly Payments,146,home/mortgage
0,9948,How Much Money Do I Need to Buy a House?,146,home/mortgage
9,9951,How to Get a Home Loan in 5 Easy Steps,25,home
8,9955,"Comparing Auto Loan Payments for 48, 60 and 72 Month Auto Loans",99,auto
0,10014,Best Ways to Add Value to Your Home,7430,home/home-equity/home-improvement
0,10017,Is a Reverse Mortgage a Bad Idea?,234,home/reverse
4,10154,Auto Insurance Discounts,160,insurance/auto
6,10158,How to Get Cheap Auto Insurance,160,insurance/auto
9,10162,How to Find Your Best Home Insurance Deal in 2017,4825,insurance/home
10,10166,Vacant Home Insurance: What It Is and How to Get the Best Price,4825,insurance/home
6,10172,Your Guide To Mobile & Manufactured Home Insurance,4825,insurance/home
4,10288,Student Loan Interest Deduction,168,student
0,10330,Net Working Capital: Managing Your Business's Financial Health,8024,business/working-capital
0,10636,Average Student Loan Debt Statistics for 2017,172,student/refinance
0,10654,Hard Money Business Loans: How to Get Approved,129,business
0,10789,Protect Yourself From Credit Card Fraud,133,credit-cards/tips
0,10808,What Credit Score is Needed for Refinancing?,150,home/refinance
7,10823,Mortgage Help: What to do if You Need Mortgage Assistance,146,home/mortgage
0,11009,Statute of Limitations on Debt,138,debt-consolidation
0,11030,Debt Relief Programs: Conquering Your Debt Problems,19622,debt-relief
0,11147,What Is A Credit Builder Loan?,164,personal
0,11204,"VA Funding Fee: What, Why and How Much",154,home/va
3,11811,Debt Help: Where Do I Start?,138,debt-consolidation
0,12160,New FHA Guidelines and Regulations,7503,home/fha/requirements
0,12496,Credit Card Application 101,133,credit-cards/tips
0,12510,VA Home Improvement Loan: 9 Things To Know,154,home/va
0,12613,Uniform Residential Loan Application 101,146,home/mortgage
0,12617,Home Renovation Loan Options,146,home/mortgage
0,12621,Home Equity Conversion Mortgage (HECM): HUD Reverse Mortgage Programs,234,home/reverse
0,12631,VA Home Loan Process: How to Get a VA Home Loan,154,home/va
0,12638,HARP Insurance FAQs,624,home/refinance/harp
0,12645,When to Buy a House: Find Out if You’re Ready,146,home/mortgage
0,12660,18 Frequently Asked Mortgage Questions,146,home/mortgage
0,12672,Debit Card 101: Everything You Need to Know,133,credit-cards/tips
0,12679,How to Protect Yourself from Credit Card Skimmers,133,credit-cards/tips
0,12694,Is a Debt Management Plan (DMP) Right for You?,138,debt-consolidation
2,12704,Debt Help: What is the definition of debt?,138,debt-consolidation
0,12714,What Is a Credit Card Authorization Form?,133,credit-cards/tips
0,12719,Best Credit Cards for Building Credit,133,credit-cards/tips
0,12720,Can you get a Mobile Home Loan?,146,home/mortgage
0,12763,Getting a Loan: Where to get a Personal Loan,164,personal
0,12771,The Truth About The Obama Student Loan Forgiveness Program,168,student
0,12776,FHA Home Requirements,7503,home/fha/requirements
0,12787,How Do Student Loans Work? Here's Everything You Need to Know.,168,student
6,12802,The Ultimate Guide to Student Loan Forgiveness for Nurses,168,student
0,12812,How to Find Grants to Pay Off Student Loans,168,student
0,12821,A Doctor's Repayment Guide: Strategies for Repaying Medical School Debt,172,student/refinance
0,12902,Get a VA Home Loan with Bad Credit,7501,home/va/requirements
0,12919,What is a Home Equity Line of Credit?,7471,home/home-equity/heloc
8,12990,Your Guide to High Risk Auto Insurance,160,insurance/auto
3,12998,Understanding Home Warranty Insurance,4825,insurance/home
3,13076,What is Renters Insurance?,4825,insurance/home
4,13081,How Much Car Insurance Do I Need?,160,insurance/auto
3,13194,What Does Homeowners Insurance Cover? What Is Not Covered?,4825,insurance/home
0,13220,Everything You Need to Know About Repaying Student Loans,172,student/refinance
0,13284,The Ultimate Guide to Parent Student Loans,168,student
0,13391,Four Steps to Building a Strong Business Credit Profile,129,business
8,13489,The Complete Guide to Paying Back Student Loans,172,student/refinance
0,13532,What is Home Equity and How Do You Use It?,142,home/home-equity
0,13584,Can You Have More Than One FHA Loan at the Same Time?,27,home/fha
0,13585,Easy Ways to Benefit from Refinancing Your Home Loan,150,home/refinance
0,13586,Interest-only Refinance,150,home/refinance
0,13587,Refinancing with Low Equity,150,home/refinance
0,13588,Reverse Mortgage Rules: What You Need to Know,234,home/reverse
0,13589,Reverse Mortgages and Estate Planning: What You Need to Know,7481,home/reverse/estate-planning
0,13590,Get the Best Rate on Your Jumbo Mortgage Refinance,150,home/refinance
0,13591,VA Home Loans and First-Time Homebuyers,154,home/va
0,13592,Understanding VA Home Appraisals,154,home/va
