Visits,id,Title,Parent,Parent Slug
0,13593,Mortgage Q & A: Can I Assume a VA Home Loan?,154,home/va
7,13594,Refinancing a Home: Are Points a Rip-off?,150,home/refinance
0,13595,Which Loan Term Is Right for Your Refinance?,150,home/refinance
0,13596,Is a Reverse Mortgage Taxable?,234,home/reverse
0,13597,I Have a VA Mortgage. Can I Get a Home Equity Loan?,154,home/va
0,13598,5 Top Candidates for a Mortgage Refinance: Are You One of Them?,150,home/refinance
0,13599,The Different Types of VA Loans,154,home/va
0,13600,4 Types of People That Get a Reverse Mortgage,234,home/reverse
0,13601,Refinance Rates: The Role of the Federal Reserve,150,home/refinance
8,13602,Wondering When to Refinance Your House? Learn These Refinancing Rules,150,home/refinance
0,13603,Are FHA Loans Only for First-Time Homebuyers? No!,27,home/fha
0,13604,Pros and Cons of FHA Loans,27,home/fha
0,13612,Mortgage Help: What to do if You Need Mortgage Assistance,146,home/mortgage
0,14121,How To Refinance Student Loans in 7 Steps,172,student/refinance
0,14168,Tips for Tackling Your Student Loan Amortization Schedule,172,student/refinance
0,14294,Marrying Someone with Student Loan Debt: What You Both Should Know,172,student/refinance
0,14653,Financing Options for Plastic Surgery,164,personal
0,14687,Can You Take Out a Personal Loan for Infertility?,164,personal
0,14703,How to Find USDA Homes,14502,home/usda
0,14709,USDA Income Limits,14515,home/usda/eligibility
0,14713,What Is a USDA Direct Loan?,14502,home/usda
0,14733,How will a rate hike impact credit card holders? A Q&A with Chris Mettler,133,credit-cards/tips
0,14849,LendingTree Launches Home Valuation Tool for My LendingTree,25,home
9,14925,How to Find the Best Student Loan Consolidation Companies,17391,student/refinance/consolidation
0,15035,How to Avoid Reverse Mortgage Scams,234,home/reverse
0,15054,Is A Reverse Mortgage Good or Bad?,234,home/reverse
0,15136,Could Your Business Benefit from an Unsecured Business Line of Credit?,8022,business/line-of-credit
0,15210,The Advantage of a Secured Business Line of Credit,8022,business/line-of-credit
0,15487,How Much Does College Cost? Understanding The Average Cost of College,168,student
0,15571,Getting Cash Flow Financing with a Cash Flow Loan,129,business
8,15609,How Much Does a Car Cost?,99,auto
2,15651,Using Home Repair Loans to Fix or Maintain a House,7430,home/home-equity/home-improvement
0,15686,Reverse Mortgage Line of Credit,234,home/reverse
0,15709,What Is a Private Party Auto Loan and How Do You Find One?,99,auto
0,15796,Buying a Car Out of State: A How-To Guide,99,auto
6,15918,Guide to Finding the Best Car Insurance for Teens,160,insurance/auto
0,15999,A Dentist's Guide: This Is How To Crush Your Dental School Debt,172,student/refinance
0,16008,Promoting Business Growth with an SBA 504 Loan,8015,business/sba
0,16043,Home Improvement Loans with No Equity,7430,home/home-equity/home-improvement
0,16049,Can You Take Out A Student Loan For Living Expenses?,168,student
0,16054,Is a Home Equity Line of Credit Tax Deductible?,7471,home/home-equity/heloc
0,16061,Can You Lease a Boat and Is This The Best Decision?,1389,boat
0,16093,How to Handle a Reverse Mortgage After Death,234,home/reverse
0,16226,How to Pay Off Your Car Loan Faster: 11 Hacks For Successful Payoff,109,auto/refinance
0,16237,Merchant Cash Advance — The Payday Loan for Businesses,129,business
0,16295,How Does Payday Loan Consolidation Work?,164,personal
4,16679,How Does Consolidating Student Loans Affect Your Credit?,17391,student/refinance/consolidation
0,16685,Student Loan Bankruptcy...Is It Possible?,168,student
0,16692,How to Find the Best Boat Loan Rates,1389,boat
0,16701,LendingTree Survey Compares Millennial Men and Women,176,finance
0,16713,Can You Get a Home Equity Line of Credit on an Investment Property?,7471,home/home-equity/heloc
0,16826,What Happens To Your Student Loans When You Die?,172,student/refinance
0,16836,Nailing Down Student Car Loans: A How-To Guide,99,auto
0,16844,How to Find the Best RV Loan Rates and Financing Terms,121,auto/rv
0,16857,SBA Express Loan: What Is It and How Does It Work?,8015,business/sba
0,16867,SBA 7a Loan: The Most Popular Small Business Administration Loan,8015,business/sba
3,16930,Why Understanding Business Line of Credit Requirements Will Make You a Better Candidate,8022,business/line-of-credit
2,16947,Equipment Leasing vs Equipment Financing: Which is Better?,8026,business/equipment
0,16956,LendKey Student Loan Refinancing Review,172,student/refinance
0,17150,Should I Pay Off My Car Loan Early or Not?,7509,auto/refinance/car-loans
4,17226,​College Ave Student Loan Refinancing Review,172,student/refinance
2,17251,Working Capital Financing: How to Find Working Capital,8024,business/working-capital
2,17276,Supplementing Working Capital with a Working Capital Line of Credit,8024,business/working-capital
0,17431,SBA Loan Requirements: How to Get an SBA Loan,8015,business/sba
0,17727,CommonBond Student Loan Refinancing Review,172,student/refinance
0,17748,SoFi Student Loan Refinancing Review,172,student/refinance
0,17756,Student Loan Refinance Review: Education Loan Finance,172,student/refinance
7,17771,Connext Student Loan Refinancing Review,172,student/refinance
0,17806,LendingTree Study Finds Time to Close Purchase Mortgage is Decreasing,176,finance
3,18207,"From Shopping to Close, LendingTree Study Finds Mortgage Process is Getting Faster",146,home/mortgage
4,18257,New Fannie Mae Guidelines: 3 Reasons It Just Got Easier to Qualify for a Mortgage,146,home/mortgage
0,18278,How Credit Card Debt Consolidation Works,7443,debt-consolidation/credit-card
0,18403,Understanding Stated-Income Loans,146,home/mortgage
0,18824,Uber Car Financing Is Nearing an End: What You Can Do Instead,99,auto
0,19119,Toyota Financing: Know Your Options in 2018,99,auto
0,19303,LendingTree’s State Migration Study Finds Homebuyers Heading South,146,home/mortgage
0,19875,What is a Good Debt-to-Income (DTI) Ratio?,138,debt-consolidation
0,19886,Understanding Debt Restructuring,138,debt-consolidation
0,20013,Good Debt Vs. Bad Debt: Understanding What You Owe,138,debt-consolidation
4,20042,"Holiday Shopping Survey Suggests Bigger Budgets, Selfless Spending and Mobile Shopping Among Parents this Holiday Season",176,finance
0,20072,Buying a Foreclosed Home: A Step-by-Step Guide,146,home/mortgage
0,20201,Should You Go Beyond the 20 Percent Down Payment?,146,home/mortgage
7,20253,Discover Student Loans Review,168,student
0,20689,Little near-term impact expected on mortgage rates from Fed action,146,home/mortgage
6,20722,Understanding Mortgage Amortization,146,home/mortgage
0,20748,Taking Advantage of the Home Mortgage Interest Tax Deduction,146,home/mortgage
0,20825,Single-family starts rise to 10-year high,146,home/mortgage
0,20839,How To Get Out Of Credit Card Debt,7443,debt-consolidation/credit-card
0,20863,Existing home sales at 11-year high,146,home/mortgage
0,20912,"Wind, rain and fire drive new home sales to 10-year high",146,home/mortgage
0,20981,Buying A Fixer-Upper: What Loans Are Available?,146,home/mortgage
0,21025,Best Ways to Get a Personal Loan,164,personal
0,21056,Fair Debt Collection Practices Act (FDCPA): Know Your Rights,138,debt-consolidation
0,21153,Jobs report adds to upward pressure on interest rates,176,finance
0,21208,How to Improve Your Chances of Getting Approved for a Personal Loan,164,personal
0,21223,You’ll Need to Set Aside More Than a Down Payment When Getting a Mortgage: Here’s Why,146,home/mortgage
0,21252,How Much Car Can I Afford? Establishing a Car Buying Budget,99,auto
0,21526,LendingTree Ranks Most Competitive Housing Markets,146,home/mortgage
0,21546,Use This New Program to Crowdfund Your Home Down Payment,146,home/mortgage
0,21587,"Sharp drop in starts is not a cause for concern, but starts are still lagging demand",146,home/mortgage
0,21613,5 Ways to Eliminate Holiday Debt in 2018,138,debt-consolidation
4,21619,Which used car brands do borrowers stretch their finances most to buy?,99,auto
0,21717,Northeast Hints at Tax Weakness,146,home/mortgage
0,21732,Buyers rushed into high priced homes as tax threat loomed,146,home/mortgage
0,21737,How To Budget Your Money,138,debt-consolidation
0,21853,Best Tips for Refinancing Your Mortgage in 2018,150,home/refinance
5,21870,LendingTree Ranks Cities With the Highest Use of Reverse Mortgages,234,home/reverse
0,22239,Mortgage Options for Foreign Nationals,146,home/mortgage
0,22273,LendingTree Ranks Best Cities for First-Time Homebuyers,146,home/mortgage
0,22449,Is Debt Consolidation a Good or Bad Idea?,138,debt-consolidation
0,22508,Starts jump to highest since October 2016,146,home/mortgage
0,22528,7 Home Equity Rules to Live By,142,home/home-equity
0,22542,Best Places for a Fresh Start,25,home
0,22558,Tax plan bites new home sales,25,home
0,22562,Entrepreneur's Salary: How Much To Pay Yourself,129,business
0,22572,Cash-Out Refinance: Know Your Options,7459,home/refinance/cash-out
0,22619,What Is a Debt Snowball?,138,debt-consolidation
0,22648,8 Questions to Answer When Checking on the Financial Health of Your Business,129,business
0,22714,Best Debt Consolidation Loans,138,debt-consolidation
0,22732,LendingTree Ranks the Best and Worst Cities for New Small Businesses,8474,business/small
0,22751,What Happens To Debt When You Die?,138,debt-consolidation
0,22852,Can You Refinance a Home With Low Equity?,150,home/refinance
6,22876,Which Loan Term Is Right for Your Refinance?,150,home/refinance
0,22901,How Much Does a Tesla Cost & How to Pay For It,99,auto
0,22935,Mortgage Savings Tracker and Mortgage Rate Competition Index,5299,home/mortgage/rates
0,22966,5 Smart Ways to Leverage Your Home Equity,142,home/home-equity
0,23222,Jobs growth strongest since July 2016 but wages disappoint,176,finance
0,23229,Understanding Lender Fees and Other Closing Costs,146,home/mortgage
6,23305,Debt Validation Letters for Debt Collectors,138,debt-consolidation
0,23368,Tips on How to Trade In Your Car,99,auto
0,23576,"Fastest Way to Pay off $5,000 or Less in Credit Card Debt",7443,debt-consolidation/credit-card
0,23603,"Starts miss expectations, but uptrend remains intact",25,home
0,23624,Should I Build an Emergency Fund or Pay Off Debt?,138,debt-consolidation
0,23633,A 20-Something’s Guide to Getting a Mortgage,146,home/mortgage
0,23661,LendingTree Ranks Most Popular Cities for Millennial Homebuyers,25,home
4,23693,Mortgage Rate Competition Index Widens,5299,home/mortgage/rates
0,23703,Refinancing: Is a 15-Year Mortgage Right for You?,150,home/refinance
0,23726,15 Dos and Don’ts of Advertising With Social Media Influencers,129,business
0,24871,Chapter 7 Bankruptcy: Understanding the Basics,23650,bankruptcy
0,24910,Tax Benefits of Buying a Home,146,home/mortgage
0,24911,Chapter 13 Bankruptcy: Understanding the Basics,23650,bankruptcy
0,24912,LendingTree Study: The Cost of Bankruptcy,23650,bankruptcy
0,24929,S Corp vs. C Corp: Understanding the Difference,7494,business/requirements
0,25018,0% APR Car Deals: Is There a Catch?,99,auto
1,25036,"Competition among lenders was worth $26,000 to borrowers last week",5299,home/mortgage/rates
0,25368,Cash-Out Refinance for Home Improvements,7459,home/refinance/cash-out
0,25477,Understanding Credit Utilization Ratio,20369,credit-repair
0,25494,How to Refinance a Rental Property,150,home/refinance
0,25532,An Overview of Major Debt Relief Companies in the U.S.,19622,debt-relief
0,25757,Best Budgeting Apps of 2018,138,debt-consolidation
0,25777,LendingTree Ranks Cities With the Highest Share of Cash-Out Refinance Borrowers,7459,home/refinance/cash-out
0,25810,How to Consolidate Your Business Debt,138,debt-consolidation
0,25855,"Competition among lenders was worth over $25,000 to borrowers last week",5299,home/mortgage/rates
0,25869,Start-Up Costs: How Much Does it Cost to Start a Small Business?,8474,business/small
0,25881,Paying for College With a Home Equity Loan,142,home/home-equity
0,25896,Chase Auto Loan: In-Depth Review,99,auto
2,25902,Tips for Tackling Debt as a Couple,138,debt-consolidation
0,25921,VA Refinance: Lower Mortgage Rates and More,154,home/va
0,25931,Is It Bad to Refinance Your Home Multiple Times?,150,home/refinance
0,25974,Overcoming Obstacles to Buying a Home,146,home/mortgage
0,26027,HELOC Balloon Payments: How to Find a Way Out,7471,home/home-equity/heloc
0,26065,How to Get Out of Debt With a Low Income,138,debt-consolidation
0,26132,Metros With the Most Fraud Alerts,176,finance
0,26178,How is my credit score calculated?,20369,credit-repair
0,26186,Ally Bank Auto Loan: In-Depth Review,99,auto
0,26221,8 Ways to Pay Off Your Mortgage Faster,146,home/mortgage
0,26278,How Long Does It Take to Refinance a House?,150,home/refinance
0,26288,Guide to Starting a Business Partnership,129,business
0,26297,5 Signs You Have Too Much Debt,138,debt-consolidation
3,26322,"Refinance Competition Was Worth $31,000 To Borrowers Last Week As Applications Fall And Lenders Compete",5299,home/mortgage/rates
0,26329,8 Tips to Shorten Your House Hunt in 2018,146,home/mortgage
0,26410,Buying a Beach House: Things to Consider,146,home/mortgage
0,26420,How to Negotiate a Home Purchase in 2018,146,home/mortgage
0,26453,LendingTree Reveals the Cities With the Highest Rates of Denied Mortgage Applications,146,home/mortgage
2,26466,Mortgage Rate Competition Index for Purchases Jumps to Widest on Record,5299,home/mortgage/rates
0,26490,How Does A Home Equity Loan Work?,142,home/home-equity
0,26513,Places That Buy the Oldest Used Cars,99,auto
0,26522,How to Buy Your Dream Home in 1 Year,146,home/mortgage
0,26589,Using a HELOC for Debt Consolidation,7471,home/home-equity/heloc
4,26603,Refinancing a Condo: What You Need to Know,150,home/refinance
0,26630,Mortgage Borrowers Could Save 10% of the Loan Amount in Interest by Shopping Around,5299,home/mortgage/rates
0,26705,Survey: Most Small Business Owners Are Using Tax Reform Savings to Pay Off Debt,8474,business/small
0,26715,Capital One Auto Loan: In-Depth Review,99,auto
0,26832,What Is Title Insurance and Why Do You Need It?,146,home/mortgage
0,26889,LendingTree Reveals Cities Where Borrowers Save the Most by Shopping Around for Mortgage Loans,146,home/mortgage
2,26907,Should I use home equity to pay off debts?,7403,debt-consolidation/home-equity
0,26922,How Does Small Business Invoice Factoring Work?,129,business
0,26928,Shopping Around Could Allow Mortgage Borrowers to Save Almost 10% of the Loan Amount in Interest,5299,home/mortgage/rates
0,26945,Chapter 11 Bankruptcy: Understanding the Basics,23650,bankruptcy
4,28667,Wells Fargo Auto Loan: In-Depth Review,99,auto
